{
  "contract_version": "1.0.0",
  "environment": "sandbox",
  "data_mode": "synthetic_demo",
  "scenario_count": 36,
  "scenarios": [
    {"scenario_id":"PBS-001","family":"flight_reservation_ticketing","change_class":"voluntary_change","flight_applicable":true,"lodging_applicable":false,"affected_travelers":1,"affected_segments":1,"affected_items":1,"affected_rooms":0,"affected_guests":0,"financial_outcomes":[],"expected_plan_state":"ready_for_human_review","required_proofs":["reservation_not_ticket","servicing_owner_explicit"]},
    {"scenario_id":"PBS-002","family":"flight_reservation_ticketing","change_class":"planned_schedule_change","flight_applicable":true,"lodging_applicable":false,"affected_travelers":2,"affected_segments":1,"affected_items":1,"affected_rooms":0,"affected_guests":0,"financial_outcomes":[],"expected_plan_state":"ready_for_human_review","required_proofs":["reservation_not_ticket","voluntary_involuntary_separate"]},
    {"scenario_id":"PBS-003","family":"flight_reservation_ticketing","change_class":"day_of_travel_disruption","flight_applicable":true,"lodging_applicable":false,"affected_travelers":1,"affected_segments":2,"affected_items":2,"affected_rooms":0,"affected_guests":0,"financial_outcomes":[],"expected_plan_state":"ready_for_human_review","required_proofs":["coupon_scope_preserved","voluntary_involuntary_separate"]},
    {"scenario_id":"PBS-004","family":"flight_reservation_ticketing","change_class":"voluntary_change","flight_applicable":true,"lodging_applicable":false,"affected_travelers":1,"affected_segments":1,"affected_items":2,"affected_rooms":0,"affected_guests":0,"financial_outcomes":[],"expected_plan_state":"ready_for_human_review","required_proofs":["emd_separate","servicing_owner_explicit"]},
    {"scenario_id":"PBS-005","family":"flight_reservation_ticketing","change_class":"planned_schedule_change","flight_applicable":true,"lodging_applicable":false,"affected_travelers":2,"affected_segments":2,"affected_items":2,"affected_rooms":0,"affected_guests":0,"financial_outcomes":[],"expected_plan_state":"evidence_required","required_proofs":["reservation_not_ticket","evidence_required"]},
    {"scenario_id":"PBS-006","family":"flight_reservation_ticketing","change_class":"day_of_travel_disruption","flight_applicable":true,"lodging_applicable":false,"affected_travelers":1,"affected_segments":1,"affected_items":1,"affected_rooms":0,"affected_guests":0,"financial_outcomes":[],"expected_plan_state":"evidence_required","required_proofs":["coupon_scope_preserved","evidence_required"]},

    {"scenario_id":"PBS-007","family":"flight_scope","change_class":"voluntary_change","flight_applicable":true,"lodging_applicable":false,"affected_travelers":1,"affected_segments":1,"affected_items":1,"affected_rooms":0,"affected_guests":0,"financial_outcomes":["even_exchange"],"expected_plan_state":"ready_for_human_review","required_proofs":["unaffected_scope_preserved","coupon_scope_preserved","no_netting"]},
    {"scenario_id":"PBS-008","family":"flight_scope","change_class":"planned_schedule_change","flight_applicable":true,"lodging_applicable":false,"affected_travelers":2,"affected_segments":1,"affected_items":1,"affected_rooms":0,"affected_guests":0,"financial_outcomes":[],"expected_plan_state":"ready_for_human_review","required_proofs":["unaffected_scope_preserved","voluntary_involuntary_separate"]},
    {"scenario_id":"PBS-009","family":"flight_scope","change_class":"day_of_travel_disruption","flight_applicable":true,"lodging_applicable":false,"affected_travelers":1,"affected_segments":3,"affected_items":2,"affected_rooms":0,"affected_guests":0,"financial_outcomes":[],"expected_plan_state":"ready_for_human_review","required_proofs":["coupon_scope_preserved","unaffected_scope_preserved"]},
    {"scenario_id":"PBS-010","family":"flight_scope","change_class":"voluntary_change","flight_applicable":true,"lodging_applicable":false,"affected_travelers":3,"affected_segments":2,"affected_items":2,"affected_rooms":0,"affected_guests":0,"financial_outcomes":["add_collect"],"expected_plan_state":"ready_for_human_review","required_proofs":["unaffected_scope_preserved","no_netting"]},
    {"scenario_id":"PBS-011","family":"flight_scope","change_class":"planned_schedule_change","flight_applicable":true,"lodging_applicable":false,"affected_travelers":1,"affected_segments":2,"affected_items":1,"affected_rooms":0,"affected_guests":0,"financial_outcomes":["refund"],"expected_plan_state":"ready_for_human_review","required_proofs":["supplier_customer_refund_separate","unaffected_scope_preserved"]},
    {"scenario_id":"PBS-012","family":"flight_scope","change_class":"day_of_travel_disruption","flight_applicable":true,"lodging_applicable":false,"affected_travelers":4,"affected_segments":4,"affected_items":3,"affected_rooms":0,"affected_guests":0,"financial_outcomes":[],"expected_plan_state":"evidence_required","required_proofs":["unaffected_scope_preserved","evidence_required"]},

    {"scenario_id":"PBS-013","family":"flight_financial","change_class":"voluntary_change","flight_applicable":true,"lodging_applicable":false,"affected_travelers":1,"affected_segments":1,"affected_items":1,"affected_rooms":0,"affected_guests":0,"financial_outcomes":["add_collect"],"expected_plan_state":"ready_for_human_review","required_proofs":["no_netting","settlement_separate"]},
    {"scenario_id":"PBS-014","family":"flight_financial","change_class":"planned_schedule_change","flight_applicable":true,"lodging_applicable":false,"affected_travelers":1,"affected_segments":1,"affected_items":1,"affected_rooms":0,"affected_guests":0,"financial_outcomes":["refund"],"expected_plan_state":"ready_for_human_review","required_proofs":["supplier_customer_refund_separate","settlement_separate"]},
    {"scenario_id":"PBS-015","family":"flight_financial","change_class":"voluntary_change","flight_applicable":true,"lodging_applicable":false,"affected_travelers":1,"affected_segments":1,"affected_items":1,"affected_rooms":0,"affected_guests":0,"financial_outcomes":["residual_value"],"expected_plan_state":"ready_for_human_review","required_proofs":["no_netting","settlement_separate"]},
    {"scenario_id":"PBS-016","family":"flight_financial","change_class":"voluntary_change","flight_applicable":true,"lodging_applicable":false,"affected_travelers":1,"affected_segments":1,"affected_items":1,"affected_rooms":0,"affected_guests":0,"financial_outcomes":["reusable_value"],"expected_plan_state":"ready_for_human_review","required_proofs":["no_netting","settlement_separate"]},
    {"scenario_id":"PBS-017","family":"flight_financial","change_class":"planned_schedule_change","flight_applicable":true,"lodging_applicable":false,"affected_travelers":2,"affected_segments":2,"affected_items":1,"affected_rooms":0,"affected_guests":0,"financial_outcomes":["even_exchange"],"expected_plan_state":"ready_for_human_review","required_proofs":["no_netting","voluntary_involuntary_separate"]},
    {"scenario_id":"PBS-018","family":"flight_financial","change_class":"voluntary_change","flight_applicable":true,"lodging_applicable":false,"affected_travelers":1,"affected_segments":1,"affected_items":1,"affected_rooms":0,"affected_guests":0,"financial_outcomes":["add_collect","refund"],"expected_plan_state":"ready_for_human_review","required_proofs":["combined_financial_components","no_netting","supplier_customer_refund_separate"]},
    {"scenario_id":"PBS-019","family":"flight_financial","change_class":"voluntary_change","flight_applicable":true,"lodging_applicable":false,"affected_travelers":1,"affected_segments":2,"affected_items":1,"affected_rooms":0,"affected_guests":0,"financial_outcomes":["add_collect","residual_value"],"expected_plan_state":"ready_for_human_review","required_proofs":["combined_financial_components","no_netting"]},
    {"scenario_id":"PBS-020","family":"flight_financial","change_class":"day_of_travel_disruption","flight_applicable":true,"lodging_applicable":false,"affected_travelers":2,"affected_segments":2,"affected_items":1,"affected_rooms":0,"affected_guests":0,"financial_outcomes":["refund","reusable_value"],"expected_plan_state":"evidence_required","required_proofs":["combined_financial_components","evidence_required","settlement_separate"]},

    {"scenario_id":"PBS-021","family":"lodging_scope","change_class":"traveler_lodging_change","flight_applicable":false,"lodging_applicable":true,"affected_travelers":0,"affected_segments":0,"affected_items":1,"affected_rooms":1,"affected_guests":2,"financial_outcomes":[],"expected_plan_state":"ready_for_human_review","required_proofs":["room_guest_date_occupancy_separate","unaffected_scope_preserved"]},
    {"scenario_id":"PBS-022","family":"lodging_scope","change_class":"supplier_initiated_lodging_change","flight_applicable":false,"lodging_applicable":true,"affected_travelers":0,"affected_segments":0,"affected_items":1,"affected_rooms":1,"affected_guests":1,"financial_outcomes":[],"expected_plan_state":"ready_for_human_review","required_proofs":["room_guest_date_occupancy_separate","message_delivery_not_booking_truth"]},
    {"scenario_id":"PBS-023","family":"lodging_scope","change_class":"traveler_lodging_change","flight_applicable":false,"lodging_applicable":true,"affected_travelers":0,"affected_segments":0,"affected_items":2,"affected_rooms":2,"affected_guests":4,"financial_outcomes":["add_collect"],"expected_plan_state":"ready_for_human_review","required_proofs":["room_guest_date_occupancy_separate","no_netting"]},
    {"scenario_id":"PBS-024","family":"lodging_scope","change_class":"supplier_initiated_lodging_change","flight_applicable":false,"lodging_applicable":true,"affected_travelers":0,"affected_segments":0,"affected_items":1,"affected_rooms":1,"affected_guests":3,"financial_outcomes":["refund"],"expected_plan_state":"ready_for_human_review","required_proofs":["room_guest_date_occupancy_separate","supplier_customer_refund_separate"]},